{"artifact_refs":[{"artifact_id":"fixture-preview-artifact","artifact_path":"contracts/fixtures/governance-models/support/fixture-preview-artifact.json","artifact_sha256":"0f854fc9597be6e7daff5699f527b70e6afc91172af4bd01401ca6645fe0d229","revision":1,"schema":"ylx.synthetic-artifact.v1"}],"component_id":"preview","config_refs":[{"artifact_id":"fixture-preview-config","artifact_path":"contracts/fixtures/governance-models/support/fixture-preview-config.json","artifact_sha256":"a41d636c1d165dbe51dc292c2f2675a6862892a0b4a6490be4da0f5d71c3e9f0","revision":1,"schema":"ylx.synthetic-artifact.v1"}],"export_contract_refs":[{"artifact_id":"fixture-preview-export","artifact_path":"contracts/fixtures/governance-models/support/fixture-preview-export.json","artifact_sha256":"84d336f9c1b3e5ee16cf4502254c602e67cdeaed82eca94029fa624a34196c49","revision":1,"schema":"ylx.synthetic-artifact.v1"}],"import_contract_refs":[],"lineage_sha256":"f0560aae4122b61850efe90db5720b3d3d503608f7a4e0a28c43aea7bda9294a","schema":"ylx.m4-component-sub-bundle.v1"}